{
  "schema_version": "2.0.0",
  "dataset_id": "fixture-gravity-v2",
  "method": "gravity",
  "data": {
    "vector_layout": "receiver-major gz",
    "components": ["gz"],
    "units": {"gz": "mGal"},
    "realification": "real-valued scalar"
  },
  "coordinates": {
    "horizontal_crs": "EPSG:32612",
    "vertical_reference": "NAVD88",
    "axis_order": "easting,northing,elevation",
    "z_positive": "up",
    "coordinate_unit": "m",
    "sign_convention": "positive gz points upward",
    "transform_error": 0.1
  },
  "acquisition": {
    "source_geometry": "passive Earth gravity field",
    "receiver_geometry": "point receivers at observation coordinates",
    "geometry_units": "m"
  },
  "sampling": {"frequencies_hz": [], "time_windows_s": []},
  "uncertainty": {
    "absolute_floor": 0.01,
    "relative_floor": 0.02,
    "covariance": {"representation": "diagonal", "reference": "config/noise.json"}
  },
  "nuisance": [
    {"name": "elevation_offset", "unit": "m", "support": "normal(0,0.1)", "owner": "geometry"}
  ],
  "applicability": {
    "included": ["regional residual gravity with frozen terrain correction"],
    "excluded": ["unknown vertical datum"]
  }
}
